"7102";"Alquiler de maquinaria y equipo n.c.p.";"K";"SERVICIOS INMOBILIARIOS , EMPRESARIALES Y DE ALQUILER";"71";"ALQUILER DE EQUIPO DE TRANSPORTE";NA;NA;"0"
"7103";"Alquiler de efectos personales y domésticos";"K";"SERVICIOS INMOBILIARIOS , EMPRESARIALES Y DE ALQUILER";"71";"ALQUILER DE EQUIPO DE TRANSPORTE";NA;NA;"0"
"72";"SERVICIOS INFORMATICOS Y ACTIVIDADES CONEXAS";"K";"SERVICIOS INMOBILIARIOS , EMPRESARIALES Y DE ALQUILER";"72";"SERVICIOS INFORMATICOS Y ACTIVIDADES CONEXAS";NA;NA;"0"
"7201";"Servicios de informática";"K";"SERVICIOS INMOBILIARIOS , EMPRESARIALES Y DE ALQUILER";"72";"SERVICIOS INFORMATICOS Y ACTIVIDADES CONEXAS";NA;NA;"0"
"7202";"Mantenimiento y reparación de maquinaria de oficina, contabilidad e informática";"K";"SERVICIOS INMOBILIARIOS , EMPRESARIALES Y DE ALQUILER";"72";"SERVICIOS INFORMATICOS Y ACTIVIDADES CONEXAS";NA;NA;"0"
"73";"INVESTIGACIÓN Y DESARROLLO";"K";"SERVICIOS INMOBILIARIOS , EMPRESARIALES Y DE ALQUILER";"73";"INVESTIGACIÓN Y DESARROLLO";NA;NA;"0"
"7300";"Investigación y desarrollo";"K";"SERVICIOS INMOBILIARIOS , EMPRESARIALES Y DE ALQUILER";"73";"INVESTIGACIÓN Y DESARROLLO";NA;NA;"0"
"74";"SERVICIOS EMPRESARIALES N.C.P.";"K";"SERVICIOS INMOBILIARIOS , EMPRESARIALES Y DE ALQUILER";"74";"SERVICIOS EMPRESARIALES N.C.P.";NA;NA;"0"
"7401";"Servicios jurídicos y de contabilidad, teneduría de libros y auditoria; asesoramiento en materia de impuestos; estudios de mercados y realización de encuestas de opinión pública; asesoramiento empresarial y en materia de gestión";"K";"SERVICIOS INMOBILIARIOS , EMPRESARIALES Y DE ALQUILER";"74";"SERVICIOS EMPRESARIALES N.C.P.";NA;NA;"0"
"7402";"Servicios de arquitectura e ingeniería y servicios técnicos n.c.p.";"K";"SERVICIOS INMOBILIARIOS , EMPRESARIALES Y DE ALQUILER";"74";"SERVICIOS EMPRESARIALES N.C.P.";NA;NA;"0"
"7403";"Servicios de publicidad";"K";"SERVICIOS INMOBILIARIOS , EMPRESARIALES Y DE ALQUILER";"74";"SERVICIOS EMPRESARIALES N.C.P.";NA;NA;"0"
"7404";"Obtención y dotación de personal";"K";"SERVICIOS INMOBILIARIOS , EMPRESARIALES Y DE ALQUILER";"74";"SERVICIOS EMPRESARIALES N.C.P.";NA;NA;"0"
"7405";"Servicios de investigación y seguridad";"K";"SERVICIOS INMOBILIARIOS , EMPRESARIALES Y DE ALQUILER";"74";"SERVICIOS EMPRESARIALES N.C.P.";NA;NA;"0"
"7406";"Servicios de limpieza de edificios";"K";"SERVICIOS INMOBILIARIOS , EMPRESARIALES Y DE ALQUILER";"74";"SERVICIOS EMPRESARIALES N.C.P.";NA;NA;"0"
"7409";"Servicios de fotografía, servicios de envase y empaque, servicios empresariales n.c.p.";"K";"SERVICIOS INMOBILIARIOS , EMPRESARIALES Y DE ALQUILER";"74";"SERVICIOS EMPRESARIALES N.C.P.";NA;NA;"0"
"75";"ADMINISTRACION PUBLICA, DEFENSA Y SEGURIDAD SOCIAL OBLIGATORIA";"L";"ADMINISTRACION PUBLICA, DEFENSA Y SEGURIDAD SOCIAL OBLIGATORIA";"75";"ADMINISTRACION PUBLICA, DEFENSA Y SEGURIDAD SOCIAL OBLIGATORIA";NA;NA;"0"
"7501";"Administración pública";"L";"ADMINISTRACION PUBLICA, DEFENSA Y SEGURIDAD SOCIAL OBLIGATORIA";"75";"ADMINISTRACION PUBLICA, DEFENSA Y SEGURIDAD SOCIAL OBLIGATORIA";NA;NA;"0"
"7502";"Fuerzas Armadas, Policías, etc.";"L";"ADMINISTRACION PUBLICA, DEFENSA Y SEGURIDAD SOCIAL OBLIGATORIA";"75";"ADMINISTRACION PUBLICA, DEFENSA Y SEGURIDAD SOCIAL OBLIGATORIA";NA;NA;"0"
"7503";"Obras Sociales";"L";"ADMINISTRACION PUBLICA, DEFENSA Y SEGURIDAD SOCIAL OBLIGATORIA";"75";"ADMINISTRACION PUBLICA, DEFENSA Y SEGURIDAD SOCIAL OBLIGATORIA";NA;NA;"0"
"80";"ENSEÑANZA";"M";"ENSEÑANZA";"80";"ENSEÑANZA";NA;NA;"0"
"8001";"Enseñanza inicial y primaria";"M";"ENSEÑANZA";"80";"ENSEÑANZA";NA;NA;"0"
"8002";"Enseñanza secundaria";"M";"ENSEÑANZA";"80";"ENSEÑANZA";NA;NA;"0"
"8003";"Enseñanza Superior o Universitaria";"M";"ENSEÑANZA";"80";"ENSEÑANZA";NA;NA;"0"
"8004";"Niveles combinados";"M";"ENSEÑANZA";"80";"ENSEÑANZA";NA;NA;"0"
"8009";"Enseñanza para adultos y servicios de enseñanza n.c.p.";"M";"ENSEÑANZA";"80";"ENSEÑANZA";NA;NA;"0"
"85";"SERVICIOS SOCIALES Y DE SALUD";"N";"SERVICIOS SOCIALES Y DE SALUD";"85";"SERVICIOS SOCIALES Y DE SALUD";NA;NA;"0"
"8501";"Servicios relacionados con la salud humana";"N";"SERVICIOS SOCIALES Y DE SALUD";"85";"SERVICIOS SOCIALES Y DE SALUD";NA;NA;"0"
"8502";"Servicios veterinarios";"N";"SERVICIOS SOCIALES Y DE SALUD";"85";"SERVICIOS SOCIALES Y DE SALUD";NA;NA;"0"
"8503";"Servicios sociales";"N";"SERVICIOS SOCIALES Y DE SALUD";"85";"SERVICIOS SOCIALES Y DE SALUD";NA;NA;"0"
"90";"ELIMINACIÓN DE DESPERDICIOS Y AGUAS RESIDUALES, SANEAMIENTO Y SERVICIOS SIMILARES";"O";"SERVICIOS COMUNITARIOS, SOCIALES Y PERSONALES N.C.P.";"90";"ELIMINACIÓN DE DESPERDICIOS Y AGUAS RESIDUALES, SANEAMIENTO Y SERVICIOS SIMILARES";NA;NA;"0"
"9000";"Eliminación de desperdicios y aguas residuales, saneamiento y servicios similares";"O";"SERVICIOS COMUNITARIOS, SOCIALES Y PERSONALES N.C.P.";"90";"ELIMINACIÓN DE DESPERDICIOS Y AGUAS RESIDUALES, SANEAMIENTO Y SERVICIOS SIMILARES";NA;NA;"0"
"91";"SERVICIOS DE ASOCIACIONES";"O";"SERVICIOS COMUNITARIOS, SOCIALES Y PERSONALES N.C.P.";"91";"SERVICIOS DE ASOCIACIONES";NA;NA;"0"
"9101";"Servicios de sindicatos";"O";"SERVICIOS COMUNITARIOS, SOCIALES Y PERSONALES N.C.P.";"91";"SERVICIOS DE ASOCIACIONES";NA;NA;"0"
"9102";"Servicios de organizaciones empresariales, profesionales y de empleadores";"O";"SERVICIOS COMUNITARIOS, SOCIALES Y PERSONALES N.C.P.";"91";"SERVICIOS DE ASOCIACIONES";NA;NA;"0"
"9109";"Servicios de asociaciones n.c.p.";"O";"SERVICIOS COMUNITARIOS, SOCIALES Y PERSONALES N.C.P.";"91";"SERVICIOS DE ASOCIACIONES";NA;NA;"0"
"92";"SERVICIOS DE ESPARCIMIENTO Y SERVICIOS CULTURALES Y DEPORTIVOS";"O";"SERVICIOS COMUNITARIOS, SOCIALES Y PERSONALES N.C.P.";"92";"SERVICIOS DE ESPARCIMIENTO Y SERVICIOS CULTURALES Y DEPORTIVOS";NA;NA;"0"
"9201";"Servicios de cinematografía, radio y televisión y servicios de espectáculos artísticos y de diversión";"O";"SERVICIOS COMUNITARIOS, SOCIALES Y PERSONALES N.C.P.";"92";"SERVICIOS DE ESPARCIMIENTO Y SERVICIOS CULTURALES Y DEPORTIVOS";NA;NA;"0"
"9202";"Servicios de agencias de noticias";"O";"SERVICIOS COMUNITARIOS, SOCIALES Y PERSONALES N.C.P.";"92";"SERVICIOS DE ESPARCIMIENTO Y SERVICIOS CULTURALES Y DEPORTIVOS";NA;NA;"0"
"9203";"Servicios de bibliotecas, archivos y museos y servicios culturales n.c.p.";"O";"SERVICIOS COMUNITARIOS, SOCIALES Y PERSONALES N.C.P.";"92";"SERVICIOS DE ESPARCIMIENTO Y SERVICIOS CULTURALES Y DEPORTIVOS";NA;NA;"0"
"9204";"Servicios para la práctica deportiva y de entretenimiento n.c.p.";"O";"SERVICIOS COMUNITARIOS, SOCIALES Y PERSONALES N.C.P.";"92";"SERVICIOS DE ESPARCIMIENTO Y SERVICIOS CULTURALES Y DEPORTIVOS";NA;NA;"0"
"93";"SERVICIOS N.C.P.";"O";"SERVICIOS COMUNITARIOS, SOCIALES Y PERSONALES N.C.P.";"93";"SERVICIOS N.C.P.";NA;NA;"0"
"9301";"Lavado y limpieza de artículos de tela, cuero y/o de piel, incluso la limpieza en seco";"O";"SERVICIOS COMUNITARIOS, SOCIALES Y PERSONALES N.C.P.";"93";"SERVICIOS N.C.P.";NA;NA;"0"
"9302";"Servicios de peluquería y tratamientos de belleza";"O";"SERVICIOS COMUNITARIOS, SOCIALES Y PERSONALES N.C.P.";"93";"SERVICIOS N.C.P.";NA;NA;"0"
"9303";"Pompas fúnebres y servicios conexos";"O";"SERVICIOS COMUNITARIOS, SOCIALES Y PERSONALES N.C.P.";"93";"SERVICIOS N.C.P.";NA;NA;"0"
"9309";"Servicios n.c.p.";"O";"SERVICIOS COMUNITARIOS, SOCIALES Y PERSONALES N.C.P.";"93";"SERVICIOS N.C.P.";NA;NA;"0"
"95";"SERVICIOS DE HOGARES PRIVADOS QUE CONTRATAN SERVICIO DOMESTICO";"P";"SERVICIOS DE HOGARES PRIVADOS QUE CONTRATAN SERVICIO DOMESTICO";"95";"SERVICIOS DE HOGARES PRIVADOS QUE CONTRATAN SERVICIO DOMESTICO";NA;NA;"0"
"9500";"Servicios de hogares privados que contratan servicio domestico";"P";"SERVICIOS DE HOGARES PRIVADOS QUE CONTRATAN SERVICIO DOMESTICO";"95";"SERVICIOS DE HOGARES PRIVADOS QUE CONTRATAN SERVICIO DOMESTICO";NA;NA;"0"
"99";"SERVICIOS DE ORGANIZACIONES Y ORGANOS EXTRATERRITORIALES";"Q";"SERVICIOS DE ORGANIZACIONES Y ORGANOS EXTRATERRITORIALES";"99";"SERVICIOS DE ORGANIZACIONES Y ORGANOS EXTRATERRITORIALES";NA;NA;"0"
"9900";"Servicios de organizaciones y órganos extraterritoriales";"Q";"SERVICIOS DE ORGANIZACIONES Y ORGANOS EXTRATERRITORIALES";"99";"SERVICIOS DE ORGANIZACIONES Y ORGANOS EXTRATERRITORIALES";NA;NA;"0"
"9999";"Ns/Nr ó Actividad no especificada claramente";"Q";"SERVICIOS DE ORGANIZACIONES Y ORGANOS EXTRATERRITORIALES";"99";"SERVICIOS DE ORGANIZACIONES Y ORGANOS EXTRATERRITORIALES";NA;NA;"0"
